<?xml version="1.0"?>
<!--
Copyright (c), 2015-2016, Quantum Espresso Foundation. All rights reserved.
This file is distributed under the terms of the MIT License. See the
file 'LICENSE' in the root directory of the present distribution, or
http://opensource.org/licenses/MIT.
Authors: Pietro Delugas
-->
<schema xmlns="http://www.w3.org/2001/XMLSchema"
	xmlns:qes_spectrum="http://www.quantum-espresso.org/ns/qes/qes_spectrum-1.0"
	targetNamespace="http://www.quantum-espresso.org/ns/qes/qes_spectrum-1.0" version="20180517">
    <element name="spectrumDoc" type="qes_spectrum:TdppOutType"/>
    <complexType name="TdppOutType">
        <sequence>
            <element name="spectrumIn" type="qes_spectrum:spectrumInType"/>
        </sequence>
    </complexType>
    <complexType name="spectrumInType">
        <sequence>
            <element name="prefix" type="string"/>
            <element name="units" type="qes_spectrum:energyUnitsType" minOccurs="0" maxOccurs="1" default="Ry"/>
            <element name="verbosity" type="integer" minOccurs="0" maxOccurs="1" default="0"/>
            <element name="outdir" type="string" minOccurs="0" maxOccurs="1" default="./"/>
            <element name="itermax" type="positiveInteger" minOccurs="0" maxOccurs="1" default="1000"/>
            <element name="itermax0" type="positiveInteger" minOccurs="0" maxOccurs="1" default="1000"/>
            <element name="itermax_actual" type="positiveInteger" minOccurs="0" maxOccurs="1"/>
            <element name="extrapolation" type="qes_spectrum:extrapolChoiceType" minOccurs="0" maxOccurs="1"/>
            <element name="start" type="double" minOccurs="0" maxOccurs="1" default="0.0"/>
            <element name="end" type="double" minOccurs="0" maxOccurs="1" default="2.5"/>
            <element name="increment" type="double" minOccurs="0" maxOccurs="1" default="0.001"/>
            <element name="ipol" type="integer" minOccurs="0" maxOccurs="1" default="1"/>

            <element name="epsil" type="double" minOccurs="0" maxOccurs="1" default="0.02"/>
            <element name="sym_op" type="integer" minOccurs="0" maxOccurs="1" default="0"/>
            <element name="td" type="qes_spectrum:tdChoiceType" minOccurs="0" maxOccurs="1" default="lanczos"/>
            <element name="io_level" type="nonNegativeInteger" minOccurs="0" maxOccurs="1"/>
            <element name="wfcdir" type="string" minOccurs="0" maxOccurs="0"/>
            <element name="max_seconds" type="positiveInteger" minOccurs="0" maxOccurs="1"/>
            <element name="eign_file" type="string" minOccurs="0" maxOccurs="1" default="pwscf.eigen"/>
            <element name="eels" type="boolean" minOccurs="0" maxOccurs="1" default="false"/>
        </sequence>
    </complexType>
    <simpleType name="energyUnitsType">
        <restriction base="string">
            <enumeration value="Ry"/>
            <enumeration value="eV"/>
            <enumeration value="nm"/>
        </restriction>
    </simpleType>
    <simpleType name="tdChoiceType">
        <restriction base="string">
            <enumeration value="lanczos"/>
            <enumeration value="davidson"/>
        </restriction>
    </simpleType>
    <simpleType name="extrapolChoiceType">
        <restriction base="string">
            <enumeration value="no"/>
            <enumeration value="osc"/>
            <enumeration value="constant"/>
        </restriction>
    </simpleType>
</schema>